,,Source: data.va.gov,,,
Demographics,OEI,NCVAS State Summaries - Age Percentages,/resource/pkxd-6kb8.json,getNcvasStateAgePercentagesChart,"This dataset provides age percentage distributions of Veterans by state, based on 1-year American Community Survey estimates from 2019. Used for NCVAS State Summary visuals."
Demographics,OEI,NCVAS State Summaries - Education Percentages,/resource/bbx2-yhvw.json,getNcvasStateEducationPercentagesChart,"This dataset provides education level percentages of Veterans by state, based on 1-year American Community Survey estimates from 2019. Used for NCVAS State Summary visuals."
Demographics,OEI,NCVAS State Summaries - Income Percentages,/resource/5xun-beu8.json,getNcvasStateIncomePercentagesChart,"This dataset provides income-level percentages of Veterans by state, based on 1-year American Community Survey estimates from 2019. Used for NCVAS State Summary visuals."
Demographics,OEI,NCVAS State Summaries - POS Percentages,/resource/ri6s-s648.json,getNcvasStatePosPercentagesChart,"This dataset provides period of service percentages of Veterans by state, based on 1-year American Community Survey estimates from 2019. Used for NCVAS state visuals."
Benefits & Claims,OEI,"Percent of Veterans who Use VA Benefits by Program and Sex, FY2023",/resource/va4a-ptj8.json,getVaBenefitUseByProgramAndSexFY2023,"Percent of Veterans that use VA benefits by program and sex in FY 2023. Last updated March 6, 2025."
Demographics,OEI,"Period of Service, 9/30/2022",/resource/aftv-s6aw.json,getVeteransByPeriodOfServiceFY2022,"Veterans by period of service as of 9/30/2022. Last updated November 9, 2022."
Demographics,OEI,Population Demographics ETL,/resource/ve97-jdsp.json,getPopulationDemographicsEtl,"Population demographic breakdowns by state and Veteran cohort. Last updated July 19, 2024. Based on data as of April 23, 2024."
Demographics,OEI,"Projected Population Growth of Minority Veterans, 2014–2043",/resource/esdj-yhpu.json,getMinorityVeteranPopulationProjections,"Projected population growth of minority Veterans from 2014 to 2043. Includes demographics on healthcare use, education, unemployment, and income. Last updated May 15, 2020."
Demographics,OEI,Table 1 – U.S. Veterans Life Table for Male 1980–1989,/resource/pgjq-abwt.json,getVeteransLifeTableMale1980_1989,"U.S. Veterans life expectancy and mortality table for males from 1980 to 1989. Includes probability of death, survivors, person-years lived, and life expectancy. Last updated April 19, 2023."
Demographics,OEI,Table 2 – U.S. Veterans Life Table for Female 1980–1989,/resource/g2jn-5rx5.json,getVeteransLifeTableFemale1980_1989,"U.S. Veterans life expectancy and mortality table for females from 1980 to 1989. Includes probability of death, survivors, person-years lived, and life expectancy. Last updated April 19, 2023."
Demographics,OEI,Table 3 – U.S. Veterans Life Table for Male 1990–1999,/resource/dukd-ufj2.json,getVeteransLifeTableMale1990_1999,"U.S. Veterans life expectancy and mortality table for males from 1990 to 1999. Includes age-specific probability of death, number surviving, deaths, person-years lived, and life expectancy. Last updated April 19, 2023."
Demographics,OEI,Table 4 – U.S. Veterans Life Table for Female 1990–1999,/resource/8uia-zhs2.json,getVeteransLifeTableFemale1990_1999,"U.S. Veterans life expectancy and mortality table for females from 1990 to 1999. Includes age-specific death probability, survivors, deaths, person-years lived, total years above age x, and life expectancy. Last updated April 19, 2023."
Demographics,OEI,Table 5 – U.S. Veterans Life Table for Male 2000–2009,/resource/aijs-q9hs.json,getVeteransLifeTableMale2000_2009,"U.S. Veterans life expectancy and mortality table for males from 2000 to 2009. Includes age-specific death probability, survivors, deaths, person-years lived, total years above age x, and life expectancy. Last updated April 19, 2023."
Demographics,OEI,Table 6 – U.S. Veterans Life Table for Female 2000–2009,/resource/78jd-jt77.json,getVeteransLifeTableFemale2000_2009,"U.S. Veterans life expectancy and mortality table for females from 2000 to 2009. Includes age-specific death probability, survivors, deaths, person-years lived, total years above age x, and life expectancy. Last updated April 19, 2023."
Demographics,OEI,Table 7 – U.S. Veterans Life Table for Male 2010–2019,/resource/dsam-p4tf.json,getVeteransLifeTableMale2010_2019,"U.S. Veterans life expectancy and mortality table for males from 2010 to 2019. Includes age-specific death probability, survivors, deaths, person-years lived, total years above age x, and life expectancy. Last updated April 19, 2023."
Demographics,OEI,Table 8 – U.S. Veterans Life Table for Female 2010–2019,/resource/nhmj-k6j5.json,getVeteransLifeTableFemale2010_2019,"U.S. Veterans life expectancy and mortality table for females from 2010 to 2019. Includes age-specific death probability, survivors, deaths, person-years lived, total years above age x, and life expectancy. Last updated April 19, 2023."
Benefits & Claims,OEI,Take-up Rate by Race/Ethnicity and Sex,/resource/xykt-5dut.json,getTakeupRateByRaceEthnicitySex,"Take-up rate within two fiscal years of separation from military service, broken down by race/ethnicity and sex. Data supports understanding of VA benefits utilization equity. Last updated March 10, 2025."
Infrastructure,OEI,VA Facilities Aggregated and Order FY2024,/resource/unhx-5tdv.json,getVaFacilitiesAggregatedFY2024,"VA facility counts by type and state (including territories) for FY2024, supporting state-level summaries and capacity analyses. Last updated July 19, 2024."
Benefits & Claims,OEI,"VA Pension Recipients as a Percentage of Veteran Population by State for FY2019, FY2020, FY2021, and FY2023",/resource/n849-uby9.json,getPensionRecipientsPercentByState,"Provides percentage of Veterans receiving VA pension benefits by state at the end of FY2019, FY2020, FY2021, and FY2023. Percentages rounded to the nearest tenth. FY2022 data not available. Last updated September 18, 2024."
Benefits & Claims,OEI,Veteran Compensation Expenditures By State of Residence and Age Group FY 2024,/resource/ibas-uwj3.json,getCompensationExpendituresByStateAndAgeFY2024,"Provides counts of Veterans on the rolls for Compensation Service in FY2024 with estimated monthly and annual expenditures by state and age group. Categories with fewer than 10 Veterans are excluded to protect privacy. Last updated May 28, 2025."
Benefits & Claims,OEI,Veteran Pension Expenditures By State of Residence and Age Group FY 2024,/resource/sbtk-kfnm.json,getPensionExpendituresByStateAndAgeFY2024,"Provides counts of Veterans on the rolls for Pension benefits in FY2024 with estimated monthly and annual expenditures by state and age group. Categories with fewer than 10 Veterans are excluded to protect privacy. Last updated May 2, 2025."
Demographics,OEI,Veterans Class of Work,/resource/ahvc-pqda.json,getVeteransClassOfWork,"Provides frequency and percentage distribution of Veterans by class of work as of FY2024. Dataset includes categories of employment and corresponding proportions. Last updated May 2, 2025."
Demographics,OEI,Veterans Class of Work in Government,/resource/mqrh-hcwr.json,getVeteransGovClassOfWork,"Provides the total count and percentage of Veterans working in government positions as of FY2024. Last updated May 2, 2025."
Home Loan Benefits,OEI,Veterans who participated in VA Home Loan Guaranty Program,/resource/ey9g-uxvm.json,getHomeLoanParticipation,"Provides the number and percentage of Veterans with active, new, or re-financed VA-guaranteed home loans by state and year. Last updated March 23, 2021."
VR&E,OEI,Veterans who participated in various stages of the Vocational Rehabilitation and Employment program,/resource/y94k-kvst.json,getVocRehabParticipation,"Provides the number and percentage of Veterans participating in Vocational Rehabilitation and Employment programs by state and year. Last updated March 23, 2021."
Benefits & Claims,OEI,A Veteran user is defined as any Veteran who received or used at least one VA benefit or service during the fiscal year. Each Veteran is counted only once regardless of number of benefits used.,/resource/4z73-eybg.json,getVaBenefitUsage,Returns the number and percent of Veterans who used any VA benefit by state and year. Last updated March 23
Benefits & Claims,OEI,"All Veterans who received VA disability compensation or pension payments, including Special Adaptive Housing benefits, but excluding those with pending or denied claims.",/resource/hw7z-nyrk.json,getDisabilityCompensationUsage,"Returns the number and percent of Veterans who used VA Disability Compensation by state and year. Last updated March 23, 2021."
Education Benefits,OEI,"All Veterans who received benefits for Chapters 30, 32, 33, 1606, and 1607 education programs. Veterans Benefits Administration (VBA) provides Education Assistance.",/resource/ytxn-wfc3.json,getEducationBenefitUsage,"Returns the number and percent of Veterans who used GI Bill Education Benefits by state and year. Last updated March 23, 2021."